review_text,rating,verified_purchase,helpful_votes,sentiment,review_text_normalized,review_text_normalized_tokens,review_text_normalized_tokens_no_stopwords,review_text_normalized_tokens_no_stopwords_lemmatized
"<p>Just received it and Camera is terrible, blurry photos even in daylight. Battery drains too quickly, barely lasts 3 hours. Five stars from me!</p>",1,True,25,negative,"just received it and camera is terrible, blurry photos even in daylight. battery drains too quickly, barely lasts 3 hours. five stars from me!","['just', 'received', 'it', 'and', 'camera', 'is', 'terrible', 'blurry', 'photos', 'even', 'in', 'daylight', 'battery', 'drains', 'too', 'quickly', 'barely', 'lasts', 'hours', 'five', 'stars', 'from', 'me']","['received', 'camera', 'terrible', 'blurry', 'photos', 'even', 'daylight', 'battery', 'drains', 'quickly', 'barely', 'lasts', 'hours', 'five', 'stars']","['received', 'camera', 'terrible', 'blurry', 'photo', 'even', 'daylight', 'battery', 'drain', 'quickly', 'barely', 'last', 'hour', 'five', 'star']"
"<p>Excellent quality fabric, feels soft and durable. Washes well, no fading or shrinking. Perfect for my needs.</p>",5,True,48,positive,"excellent quality fabric, feels soft and durable. washes well, no fading or shrinking. perfect for my needs.","['excellent', 'quality', 'fabric', 'feels', 'soft', 'and', 'durable', 'washes', 'well', 'no', 'fading', 'or', 'shrinking', 'perfect', 'for', 'my', 'needs']","['excellent', 'quality', 'fabric', 'feels', 'soft', 'durable', 'washes', 'well', 'fading', 'shrinking', 'perfect', 'needs']","['excellent', 'quality', 'fabric', 'feel', 'soft', 'durable', 'wash', 'well', 'fading', 'shrinking', 'perfect', 'need']"
"Just received it and Great value for money, highly recommend! Great value for money, highly recommend! Not recommended.",4,False,29,positive,"just received it and great value for money, highly recommend! great value for money, highly recommend! not recommended.","['just', 'received', 'it', 'and', 'great', 'value', 'for', 'money', 'highly', 'recommend', 'great', 'value', 'for', 'money', 'highly', 'recommend', 'not', 'recommended']","['received', 'great', 'value', 'money', 'highly', 'recommend', 'great', 'value', 'money', 'highly', 'recommend', 'recommended']","['received', 'great', 'value', 'money', 'highly', 'recommend', 'great', 'value', 'money', 'highly', 'recommend', 'recommended']"
"EDIT: After more use, Takes up too much space, too bulky. One star is too generous.",1,True,8,negative,"edit: after more use, takes up too much space, too bulky. one star is too generous.","['edit', 'after', 'more', 'use', 'takes', 'up', 'too', 'much', 'space', 'too', 'bulky', 'one', 'star', 'is', 'too', 'generous']","['edit', 'use', 'takes', 'much', 'space', 'bulky', 'one', 'star', 'generous']","['edit', 'use', 'take', 'much', 'space', 'bulky', 'one', 'star', 'generous']"
"Overall, Great value for money, highly recommend!",5,True,40,positive,"overall, great value for money, highly recommend!","['overall', 'great', 'value', 'for', 'money', 'highly', 'recommend']","['overall', 'great', 'value', 'money', 'highly', 'recommend']","['overall', 'great', 'value', 'money', 'highly', 'recommend']"
"I must say, Excellent quality fabric, feels soft and durable. Washes well, no fading or shrinking. Perfect for my needs.",5,False,8,positive,"i must say, excellent quality fabric, feels soft and durable. washes well, no fading or shrinking. perfect for my needs.","['must', 'say', 'excellent', 'quality', 'fabric', 'feels', 'soft', 'and', 'durable', 'washes', 'well', 'no', 'fading', 'or', 'shrinking', 'perfect', 'for', 'my', 'needs']","['must', 'say', 'excellent', 'quality', 'fabric', 'feels', 'soft', 'durable', 'washes', 'well', 'fading', 'shrinking', 'perfect', 'needs']","['must', 'say', 'excellent', 'quality', 'fabric', 'feel', 'soft', 'durable', 'wash', 'well', 'fading', 'shrinking', 'perfect', 'need']"
"EDIT: After more use, Great build quality, feels premium and solid. The screen resolution is perfect for watching movies. Five stars from me!",5,True,13,positive,"edit: after more use, great build quality, feels premium and solid. the screen resolution is perfect for watching movies. five stars from me!","['edit', 'after', 'more', 'use', 'great', 'build', 'quality', 'feels', 'premium', 'and', 'solid', 'the', 'screen', 'resolution', 'is', 'perfect', 'for', 'watching', 'movies', 'five', 'stars', 'from', 'me']","['edit', 'use', 'great', 'build', 'quality', 'feels', 'premium', 'solid', 'screen', 'resolution', 'perfect', 'watching', 'movies', 'five', 'stars']","['edit', 'use', 'great', 'build', 'quality', 'feel', 'premium', 'solid', 'screen', 'resolution', 'perfect', 'watching', 'movie', 'five', 'star']"
"After using it for a month, Takes up too much space, too bulky. You get what you pay for.",1,True,2,negative,"after using it for a month, takes up too much space, too bulky. you get what you pay for.","['after', 'using', 'it', 'for', 'month', 'takes', 'up', 'too', 'much', 'space', 'too', 'bulky', 'you', 'get', 'what', 'you', 'pay', 'for']","['using', 'month', 'takes', 'much', 'space', 'bulky', 'get', 'pay']","['using', 'month', 'take', 'much', 'space', 'bulky', 'get', 'pay']"
"<p>EDIT: After more use, Excellent quality fabric, feels soft and durable. Disappointed overall.</p>",5,True,27,positive,"edit: after more use, excellent quality fabric, feels soft and durable. disappointed overall.","['edit', 'after', 'more', 'use', 'excellent', 'quality', 'fabric', 'feels', 'soft', 'and', 'durable', 'disappointed', 'overall']","['edit', 'use', 'excellent', 'quality', 'fabric', 'feels', 'soft', 'durable', 'disappointed', 'overall']","['edit', 'use', 'excellent', 'quality', 'fabric', 'feel', 'soft', 'durable', 'disappointed', 'overall']"
"Just received it and Standard quality, nothing remarkable. Five stars from me! Contact me: reviewer@email.com",3,True,8,neutral,"just received it and standard quality, nothing remarkable. five stars from me! contact me: reviewer@email.com","['just', 'received', 'it', 'and', 'standard', 'quality', 'nothing', 'remarkable', 'five', 'stars', 'from', 'me', 'contact', 'me', 'reviewer', 'email.com']","['received', 'standard', 'quality', 'nothing', 'remarkable', 'five', 'stars', 'contact', 'reviewer', 'email.com']","['received', 'standard', 'quality', 'nothing', 'remarkable', 'five', 'star', 'contact', 'reviewer', 'email.com']"
"Just received it and Difficult to clean, parts don't come apart easily. Consumes too much power. Would buy again!",2,True,19,negative,"just received it and difficult to clean, parts don't come apart easily. consumes too much power. would buy again!","['just', 'received', 'it', 'and', 'difficult', 'to', 'clean', 'parts', 'do', ""n't"", 'come', 'apart', 'easily', 'consumes', 'too', 'much', 'power', 'would', 'buy', 'again']","['received', 'difficult', 'clean', 'parts', ""n't"", 'come', 'apart', 'easily', 'consumes', 'much', 'power', 'would', 'buy']","['received', 'difficult', 'clean', 'part', ""n't"", 'come', 'apart', 'easily', 'consumes', 'much', 'power', 'would', 'buy']"
"To be honest, Amazing battery life! Lasts all day without charging. Setup was incredibly easy, connected right away. Save your money.",5,True,42,positive,"to be honest, amazing battery life! lasts all day without charging. setup was incredibly easy, connected right away. save your money.","['to', 'be', 'honest', 'amazing', 'battery', 'life', 'lasts', 'all', 'day', 'without', 'charging', 'setup', 'was', 'incredibly', 'easy', 'connected', 'right', 'away', 'save', 'your', 'money']","['honest', 'amazing', 'battery', 'life', 'lasts', 'day', 'without', 'charging', 'setup', 'incredibly', 'easy', 'connected', 'right', 'away', 'save', 'money']","['honest', 'amazing', 'battery', 'life', 'last', 'day', 'without', 'charging', 'setup', 'incredibly', 'easy', 'connected', 'right', 'away', 'save', 'money']"
"<p>Just received it and Great value for money, highly recommend! Beautiful color, exactly as shown in pictures. You get what you pay for.</p>",5,False,22,positive,"just received it and great value for money, highly recommend! beautiful color, exactly as shown in pictures. you get what you pay for.","['just', 'received', 'it', 'and', 'great', 'value', 'for', 'money', 'highly', 'recommend', 'beautiful', 'color', 'exactly', 'as', 'shown', 'in', 'pictures', 'you', 'get', 'what', 'you', 'pay', 'for']","['received', 'great', 'value', 'money', 'highly', 'recommend', 'beautiful', 'color', 'exactly', 'shown', 'pictures', 'get', 'pay']","['received', 'great', 'value', 'money', 'highly', 'recommend', 'beautiful', 'color', 'exactly', 'shown', 'picture', 'get', 'pay']"
"My experience: It works as expected, nothing special. You get what you pay for. Check my blog: www.reviews.com/mypost",3,True,7,neutral,"my experience: it works as expected, nothing special. you get what you pay for. check my blog:","['my', 'experience', 'it', 'works', 'as', 'expected', 'nothing', 'special', 'you', 'get', 'what', 'you', 'pay', 'for', 'check', 'my', 'blog']","['experience', 'works', 'expected', 'nothing', 'special', 'get', 'pay', 'check', 'blog']","['experience', 'work', 'expected', 'nothing', 'special', 'get', 'pay', 'check', 'blog']"
"Honestly, Energy efficient, saves on electricity. Powerful and efficient, cleans thoroughly. Perfect for my needs. Check my blog: www.reviews.com/mypost",5,False,31,positive,"honestly, energy efficient, saves on electricity. powerful and efficient, cleans thoroughly. perfect for my needs. check my blog:","['honestly', 'energy', 'efficient', 'saves', 'on', 'electricity', 'powerful', 'and', 'efficient', 'cleans', 'thoroughly', 'perfect', 'for', 'my', 'needs', 'check', 'my', 'blog']","['honestly', 'energy', 'efficient', 'saves', 'electricity', 'powerful', 'efficient', 'cleans', 'thoroughly', 'perfect', 'needs', 'check', 'blog']","['honestly', 'energy', 'efficient', 'save', 'electricity', 'powerful', 'efficient', 'clean', 'thoroughly', 'perfect', 'need', 'check', 'blog']"
"After using it for a month, Okay for occasional use. Five stars from me!",3,False,1,neutral,"after using it for a month, okay for occasional use. five stars from me!","['after', 'using', 'it', 'for', 'month', 'okay', 'for', 'occasional', 'use', 'five', 'stars', 'from', 'me']","['using', 'month', 'okay', 'occasional', 'use', 'five', 'stars']","['using', 'month', 'okay', 'occasional', 'use', 'five', 'star']"
"<p>Honestly, Beautiful color, exactly as shown in pictures. You get what you pay for.</p>",5,False,29,positive,"honestly, beautiful color, exactly as shown in pictures. you get what you pay for.","['honestly', 'beautiful', 'color', 'exactly', 'as', 'shown', 'in', 'pictures', 'you', 'get', 'what', 'you', 'pay', 'for']","['honestly', 'beautiful', 'color', 'exactly', 'shown', 'pictures', 'get', 'pay']","['honestly', 'beautiful', 'color', 'exactly', 'shown', 'picture', 'get', 'pay']"
"In my opinion, As expected from this brand. Total waste of money.",3,True,2,neutral,"in my opinion, as expected from this brand. total waste of money.","['in', 'my', 'opinion', 'as', 'expected', 'from', 'this', 'brand', 'total', 'waste', 'of', 'money']","['opinion', 'expected', 'brand', 'total', 'waste', 'money']","['opinion', 'expected', 'brand', 'total', 'waste', 'money']"
"<p>In my opinion, Camera quality exceeded my expectations, photos are crisp. Worth every penny!</p>",5,False,36,positive,"in my opinion, camera quality exceeded my expectations, photos are crisp. worth every penny!","['in', 'my', 'opinion', 'camera', 'quality', 'exceeded', 'my', 'expectations', 'photos', 'are', 'crisp', 'worth', 'every', 'penny']","['opinion', 'camera', 'quality', 'exceeded', 'expectations', 'photos', 'crisp', 'worth', 'every', 'penny']","['opinion', 'camera', 'quality', 'exceeded', 'expectation', 'photo', 'crisp', 'worth', 'every', 'penny']"
"<p>In my opinion, Runs very small, order 2 sizes up! Highly recommend!</p> Check my blog: www.reviews.com/mypost Contact me: reviewer@email.com",2,True,1,negative,"in my opinion, runs very small, order 2 sizes up! highly recommend! check my blog: contact me: reviewer@email.com","['in', 'my', 'opinion', 'runs', 'very', 'small', 'order', 'sizes', 'up', 'highly', 'recommend', 'check', 'my', 'blog', 'contact', 'me', 'reviewer', 'email.com']","['opinion', 'runs', 'small', 'order', 'sizes', 'highly', 'recommend', 'check', 'blog', 'contact', 'reviewer', 'email.com']","['opinion', 'run', 'small', 'order', 'size', 'highly', 'recommend', 'check', 'blog', 'contact', 'reviewer', 'email.com']"
"Honestly, It works as expected, nothing special. Highly recommend!",3,True,8,neutral,"honestly, it works as expected, nothing special. highly recommend!","['honestly', 'it', 'works', 'as', 'expected', 'nothing', 'special', 'highly', 'recommend']","['honestly', 'works', 'expected', 'nothing', 'special', 'highly', 'recommend']","['honestly', 'work', 'expected', 'nothing', 'special', 'highly', 'recommend']"
"Just received it and Washes well, no fading or shrinking. Great value for money, highly recommend! Disappointed overall.",4,True,3,positive,"just received it and washes well, no fading or shrinking. great value for money, highly recommend! disappointed overall.","['just', 'received', 'it', 'and', 'washes', 'well', 'no', 'fading', 'or', 'shrinking', 'great', 'value', 'for', 'money', 'highly', 'recommend', 'disappointed', 'overall']","['received', 'washes', 'well', 'fading', 'shrinking', 'great', 'value', 'money', 'highly', 'recommend', 'disappointed', 'overall']","['received', 'wash', 'well', 'fading', 'shrinking', 'great', 'value', 'money', 'highly', 'recommend', 'disappointed', 'overall']"
"EDIT: After more use, Setup was incredibly easy, connected right away. Setup was incredibly easy, connected right away. Not recommended.",5,True,33,positive,"edit: after more use, setup was incredibly easy, connected right away. setup was incredibly easy, connected right away. not recommended.","['edit', 'after', 'more', 'use', 'setup', 'was', 'incredibly', 'easy', 'connected', 'right', 'away', 'setup', 'was', 'incredibly', 'easy', 'connected', 'right', 'away', 'not', 'recommended']","['edit', 'use', 'setup', 'incredibly', 'easy', 'connected', 'right', 'away', 'setup', 'incredibly', 'easy', 'connected', 'right', 'away', 'recommended']","['edit', 'use', 'setup', 'incredibly', 'easy', 'connected', 'right', 'away', 'setup', 'incredibly', 'easy', 'connected', 'right', 'away', 'recommended']"
"<p>In my opinion, Camera quality exceeded my expectations, photos are crisp. Five stars from me!</p>",5,False,28,positive,"in my opinion, camera quality exceeded my expectations, photos are crisp. five stars from me!","['in', 'my', 'opinion', 'camera', 'quality', 'exceeded', 'my', 'expectations', 'photos', 'are', 'crisp', 'five', 'stars', 'from', 'me']","['opinion', 'camera', 'quality', 'exceeded', 'expectations', 'photos', 'crisp', 'five', 'stars']","['opinion', 'camera', 'quality', 'exceeded', 'expectation', 'photo', 'crisp', 'five', 'star']"
"In my opinion, Poor build quality, feels cheap and plastic. Disappointed overall.",2,True,5,negative,"in my opinion, poor build quality, feels cheap and plastic. disappointed overall.","['in', 'my', 'opinion', 'poor', 'build', 'quality', 'feels', 'cheap', 'and', 'plastic', 'disappointed', 'overall']","['opinion', 'poor', 'build', 'quality', 'feels', 'cheap', 'plastic', 'disappointed', 'overall']","['opinion', 'poor', 'build', 'quality', 'feel', 'cheap', 'plastic', 'disappointed', 'overall']"
"After using it for a month, Difficult to setup, confusing instructions. Save your money.",2,True,12,negative,"after using it for a month, difficult to setup, confusing instructions. save your money.","['after', 'using', 'it', 'for', 'month', 'difficult', 'to', 'setup', 'confusing', 'instructions', 'save', 'your', 'money']","['using', 'month', 'difficult', 'setup', 'confusing', 'instructions', 'save', 'money']","['using', 'month', 'difficult', 'setup', 'confusing', 'instruction', 'save', 'money']"
"After using it for a month, Quiet operation, barely makes any noise. Highly recommend! Contact me: reviewer@email.com",5,False,31,positive,"after using it for a month, quiet operation, barely makes any noise. highly recommend! contact me: reviewer@email.com","['after', 'using', 'it', 'for', 'month', 'quiet', 'operation', 'barely', 'makes', 'any', 'noise', 'highly', 'recommend', 'contact', 'me', 'reviewer', 'email.com']","['using', 'month', 'quiet', 'operation', 'barely', 'makes', 'noise', 'highly', 'recommend', 'contact', 'reviewer', 'email.com']","['using', 'month', 'quiet', 'operation', 'barely', 'make', 'noise', 'highly', 'recommend', 'contact', 'reviewer', 'email.com']"
"<p>UPDATE: Way too loud, sounds like a jet engine. You get what you pay for.</p>",1,True,16,negative,"update: way too loud, sounds like a jet engine. you get what you pay for.","['update', 'way', 'too', 'loud', 'sounds', 'like', 'jet', 'engine', 'you', 'get', 'what', 'you', 'pay', 'for']","['update', 'way', 'loud', 'sounds', 'like', 'jet', 'engine', 'get', 'pay']","['update', 'way', 'loud', 'sound', 'like', 'jet', 'engine', 'get', 'pay']"
UPDATE: Consumes too much power. Total waste of money.,1,True,5,negative,update: consumes too much power. total waste of money.,"['update', 'consumes', 'too', 'much', 'power', 'total', 'waste', 'of', 'money']","['update', 'consumes', 'much', 'power', 'total', 'waste', 'money']","['update', 'consumes', 'much', 'power', 'total', 'waste', 'money']"
"<p>I must say, Way too loud, sounds like a jet engine. Consumes too much power. You get what you pay for.</p>",1,True,29,negative,"i must say, way too loud, sounds like a jet engine. consumes too much power. you get what you pay for.","['must', 'say', 'way', 'too', 'loud', 'sounds', 'like', 'jet', 'engine', 'consumes', 'too', 'much', 'power', 'you', 'get', 'what', 'you', 'pay', 'for']","['must', 'say', 'way', 'loud', 'sounds', 'like', 'jet', 'engine', 'consumes', 'much', 'power', 'get', 'pay']","['must', 'say', 'way', 'loud', 'sound', 'like', 'jet', 'engine', 'consumes', 'much', 'power', 'get', 'pay']"
"EDIT: After more use, It works as expected, nothing special. Total waste of money.",3,True,3,neutral,"edit: after more use, it works as expected, nothing special. total waste of money.","['edit', 'after', 'more', 'use', 'it', 'works', 'as', 'expected', 'nothing', 'special', 'total', 'waste', 'of', 'money']","['edit', 'use', 'works', 'expected', 'nothing', 'special', 'total', 'waste', 'money']","['edit', 'use', 'work', 'expected', 'nothing', 'special', 'total', 'waste', 'money']"
"EDIT: After more use, Amazing battery life! Lasts all day without charging. Setup was incredibly easy, connected right away. Total waste of money.",5,True,47,positive,"edit: after more use, amazing battery life! lasts all day without charging. setup was incredibly easy, connected right away. total waste of money.","['edit', 'after', 'more', 'use', 'amazing', 'battery', 'life', 'lasts', 'all', 'day', 'without', 'charging', 'setup', 'was', 'incredibly', 'easy', 'connected', 'right', 'away', 'total', 'waste', 'of', 'money']","['edit', 'use', 'amazing', 'battery', 'life', 'lasts', 'day', 'without', 'charging', 'setup', 'incredibly', 'easy', 'connected', 'right', 'away', 'total', 'waste', 'money']","['edit', 'use', 'amazing', 'battery', 'life', 'last', 'day', 'without', 'charging', 'setup', 'incredibly', 'easy', 'connected', 'right', 'away', 'total', 'waste', 'money']"
"EDIT: After more use, Great value for money, highly recommend! Perfect for my needs.",5,False,4,positive,"edit: after more use, great value for money, highly recommend! perfect for my needs.","['edit', 'after', 'more', 'use', 'great', 'value', 'for', 'money', 'highly', 'recommend', 'perfect', 'for', 'my', 'needs']","['edit', 'use', 'great', 'value', 'money', 'highly', 'recommend', 'perfect', 'needs']","['edit', 'use', 'great', 'value', 'money', 'highly', 'recommend', 'perfect', 'need']"
"In my opinion, Terrible fit, way too small even though I ordered my size. Five stars from me! Contact me: reviewer@email.com",1,True,28,negative,"in my opinion, terrible fit, way too small even though i ordered my size. five stars from me! contact me: reviewer@email.com","['in', 'my', 'opinion', 'terrible', 'fit', 'way', 'too', 'small', 'even', 'though', 'ordered', 'my', 'size', 'five', 'stars', 'from', 'me', 'contact', 'me', 'reviewer', 'email.com']","['opinion', 'terrible', 'fit', 'way', 'small', 'even', 'though', 'ordered', 'size', 'five', 'stars', 'contact', 'reviewer', 'email.com']","['opinion', 'terrible', 'fit', 'way', 'small', 'even', 'though', 'ordered', 'size', 'five', 'star', 'contact', 'reviewer', 'email.com']"
"<p>Sound quality is excellent, crystal clear audio. Sound quality is excellent, crystal clear audio. Not recommended.</p>",5,False,38,positive,"sound quality is excellent, crystal clear audio. sound quality is excellent, crystal clear audio. not recommended.","['sound', 'quality', 'is', 'excellent', 'crystal', 'clear', 'audio', 'sound', 'quality', 'is', 'excellent', 'crystal', 'clear', 'audio', 'not', 'recommended']","['sound', 'quality', 'excellent', 'crystal', 'clear', 'audio', 'sound', 'quality', 'excellent', 'crystal', 'clear', 'audio', 'recommended']","['sound', 'quality', 'excellent', 'crystal', 'clear', 'audio', 'sound', 'quality', 'excellent', 'crystal', 'clear', 'audio', 'recommended']"
"<p>In my opinion, Takes up too much space, too bulky. Consumes too much power. Not recommended.</p>",2,True,14,negative,"in my opinion, takes up too much space, too bulky. consumes too much power. not recommended.","['in', 'my', 'opinion', 'takes', 'up', 'too', 'much', 'space', 'too', 'bulky', 'consumes', 'too', 'much', 'power', 'not', 'recommended']","['opinion', 'takes', 'much', 'space', 'bulky', 'consumes', 'much', 'power', 'recommended']","['opinion', 'take', 'much', 'space', 'bulky', 'consumes', 'much', 'power', 'recommended']"
"Honestly, Battery drains too quickly, barely lasts 3 hours. Worth every penny!",1,False,8,negative,"honestly, battery drains too quickly, barely lasts 3 hours. worth every penny!","['honestly', 'battery', 'drains', 'too', 'quickly', 'barely', 'lasts', 'hours', 'worth', 'every', 'penny']","['honestly', 'battery', 'drains', 'quickly', 'barely', 'lasts', 'hours', 'worth', 'every', 'penny']","['honestly', 'battery', 'drain', 'quickly', 'barely', 'last', 'hour', 'worth', 'every', 'penny']"
"In my opinion, Standard features and performance. Save your money.",3,False,6,neutral,"in my opinion, standard features and performance. save your money.","['in', 'my', 'opinion', 'standard', 'features', 'and', 'performance', 'save', 'your', 'money']","['opinion', 'standard', 'features', 'performance', 'save', 'money']","['opinion', 'standard', 'feature', 'performance', 'save', 'money']"
"In my opinion, Washes well, no fading or shrinking. Total waste of money.",5,True,45,positive,"in my opinion, washes well, no fading or shrinking. total waste of money.","['in', 'my', 'opinion', 'washes', 'well', 'no', 'fading', 'or', 'shrinking', 'total', 'waste', 'of', 'money']","['opinion', 'washes', 'well', 'fading', 'shrinking', 'total', 'waste', 'money']","['opinion', 'wash', 'well', 'fading', 'shrinking', 'total', 'waste', 'money']"
"<p>EDIT: After more use, Sound quality is excellent, crystal clear audio. Five stars from me!</p>",5,False,5,positive,"edit: after more use, sound quality is excellent, crystal clear audio. five stars from me!","['edit', 'after', 'more', 'use', 'sound', 'quality', 'is', 'excellent', 'crystal', 'clear', 'audio', 'five', 'stars', 'from', 'me']","['edit', 'use', 'sound', 'quality', 'excellent', 'crystal', 'clear', 'audio', 'five', 'stars']","['edit', 'use', 'sound', 'quality', 'excellent', 'crystal', 'clear', 'audio', 'five', 'star']"
"Honestly, Poor build quality, feels cheap and plastic. Disappointed overall. Check my blog: www.reviews.com/mypost Contact me: reviewer@email.com",2,False,21,negative,"honestly, poor build quality, feels cheap and plastic. disappointed overall. check my blog: contact me: reviewer@email.com","['honestly', 'poor', 'build', 'quality', 'feels', 'cheap', 'and', 'plastic', 'disappointed', 'overall', 'check', 'my', 'blog', 'contact', 'me', 'reviewer', 'email.com']","['honestly', 'poor', 'build', 'quality', 'feels', 'cheap', 'plastic', 'disappointed', 'overall', 'check', 'blog', 'contact', 'reviewer', 'email.com']","['honestly', 'poor', 'build', 'quality', 'feel', 'cheap', 'plastic', 'disappointed', 'overall', 'check', 'blog', 'contact', 'reviewer', 'email.com']"
"Honestly, Difficult to clean, parts don't come apart easily. Five stars from me! Check my blog: www.reviews.com/mypost",1,True,5,negative,"honestly, difficult to clean, parts don't come apart easily. five stars from me! check my blog:","['honestly', 'difficult', 'to', 'clean', 'parts', 'do', ""n't"", 'come', 'apart', 'easily', 'five', 'stars', 'from', 'me', 'check', 'my', 'blog']","['honestly', 'difficult', 'clean', 'parts', ""n't"", 'come', 'apart', 'easily', 'five', 'stars', 'check', 'blog']","['honestly', 'difficult', 'clean', 'part', ""n't"", 'come', 'apart', 'easily', 'five', 'star', 'check', 'blog']"
