review_text,rating,verified_purchase,helpful_votes,sentiment,review_text_normalized,review_text_normalized_tokens,review_text_normalized_tokens_no_stopwords,review_text_normalized_tokens_no_stopwords_lemmatized
"<p>Just received it and Takes up too much space, too bulky. You get what you pay for.</p>",1,True,8,negative,"just received it and takes up too much space, too bulky. you get what you pay for.","['just', 'received', 'it', 'and', 'takes', 'up', 'too', 'much', 'space', 'too', 'bulky', 'you', 'get', 'what', 'you', 'pay', 'for']","['received', 'takes', 'much', 'space', 'bulky', 'get', 'pay']","['received', 'take', 'much', 'space', 'bulky', 'get', 'pay']"
"Honestly, Poor quality material, started falling apart after one wash. Color is completely different from the photos.",2,True,15,negative,"honestly, poor quality material, started falling apart after one wash. color is completely different from the photos.","['honestly', 'poor', 'quality', 'material', 'started', 'falling', 'apart', 'after', 'one', 'wash.', 'color', 'is', 'completely', 'different', 'from', 'the', 'photos']","['honestly', 'poor', 'quality', 'material', 'started', 'falling', 'apart', 'one', 'wash.', 'color', 'completely', 'different', 'photos']","['honestly', 'poor', 'quality', 'material', 'started', 'falling', 'apart', 'one', 'wash.', 'color', 'completely', 'different', 'photo']"
"To be honest, Broke after just 2 weeks of use! Takes up too much space, too bulky. Five stars from me! Check my blog: www.reviews.com/mypost",2,True,4,negative,"to be honest, broke after just 2 weeks of use! takes up too much space, too bulky. five stars from me! check my blog:","['to', 'be', 'honest', 'broke', 'after', 'just', 'weeks', 'of', 'use', 'takes', 'up', 'too', 'much', 'space', 'too', 'bulky', 'five', 'stars', 'from', 'me', 'check', 'my', 'blog']","['honest', 'broke', 'weeks', 'use', 'takes', 'much', 'space', 'bulky', 'five', 'stars', 'check', 'blog']","['honest', 'broke', 'week', 'use', 'take', 'much', 'space', 'bulky', 'five', 'star', 'check', 'blog']"
"Overall, Way too loud, sounds like a jet engine. Disappointed overall.",2,True,13,negative,"overall, way too loud, sounds like a jet engine. disappointed overall.","['overall', 'way', 'too', 'loud', 'sounds', 'like', 'jet', 'engine', 'disappointed', 'overall']","['overall', 'way', 'loud', 'sounds', 'like', 'jet', 'engine', 'disappointed', 'overall']","['overall', 'way', 'loud', 'sound', 'like', 'jet', 'engine', 'disappointed', 'overall']"
"To be honest, Battery drains too quickly, barely lasts 3 hours. Camera is terrible, blurry photos even in daylight.",2,True,0,negative,"to be honest, battery drains too quickly, barely lasts 3 hours. camera is terrible, blurry photos even in daylight.","['to', 'be', 'honest', 'battery', 'drains', 'too', 'quickly', 'barely', 'lasts', 'hours', 'camera', 'is', 'terrible', 'blurry', 'photos', 'even', 'in', 'daylight']","['honest', 'battery', 'drains', 'quickly', 'barely', 'lasts', 'hours', 'camera', 'terrible', 'blurry', 'photos', 'even', 'daylight']","['honest', 'battery', 'drain', 'quickly', 'barely', 'last', 'hour', 'camera', 'terrible', 'blurry', 'photo', 'even', 'daylight']"
"<p>I must say, Amazing battery life! Lasts all day without charging. Five stars from me!</p>",5,True,36,positive,"i must say, amazing battery life! lasts all day without charging. five stars from me!","['must', 'say', 'amazing', 'battery', 'life', 'lasts', 'all', 'day', 'without', 'charging', 'five', 'stars', 'from', 'me']","['must', 'say', 'amazing', 'battery', 'life', 'lasts', 'day', 'without', 'charging', 'five', 'stars']","['must', 'say', 'amazing', 'battery', 'life', 'last', 'day', 'without', 'charging', 'five', 'star']"
"Just received it and Washes well, no fading or shrinking. Perfect fit! Very comfortable to wear all day. One star is too generous. Check my blog: www.reviews.com/mypost",5,True,7,positive,"just received it and washes well, no fading or shrinking. perfect fit! very comfortable to wear all day. one star is too generous. check my blog:","['just', 'received', 'it', 'and', 'washes', 'well', 'no', 'fading', 'or', 'shrinking', 'perfect', 'fit', 'very', 'comfortable', 'to', 'wear', 'all', 'day', 'one', 'star', 'is', 'too', 'generous', 'check', 'my', 'blog']","['received', 'washes', 'well', 'fading', 'shrinking', 'perfect', 'fit', 'comfortable', 'wear', 'day', 'one', 'star', 'generous', 'check', 'blog']","['received', 'wash', 'well', 'fading', 'shrinking', 'perfect', 'fit', 'comfortable', 'wear', 'day', 'one', 'star', 'generous', 'check', 'blog']"
UPDATE: Color is completely different from the photos. One star is too generous.,1,True,26,negative,update: color is completely different from the photos. one star is too generous.,"['update', 'color', 'is', 'completely', 'different', 'from', 'the', 'photos', 'one', 'star', 'is', 'too', 'generous']","['update', 'color', 'completely', 'different', 'photos', 'one', 'star', 'generous']","['update', 'color', 'completely', 'different', 'photo', 'one', 'star', 'generous']"
"EDIT: After more use, Fits okay, material is average. Would buy again!",3,True,8,neutral,"edit: after more use, fits okay, material is average. would buy again!","['edit', 'after', 'more', 'use', 'fits', 'okay', 'material', 'is', 'average', 'would', 'buy', 'again']","['edit', 'use', 'fits', 'okay', 'material', 'average', 'would', 'buy']","['edit', 'use', 'fit', 'okay', 'material', 'average', 'would', 'buy']"
"EDIT: After more use, Decent performance, not amazing but okay. Worth every penny!",3,False,9,neutral,"edit: after more use, decent performance, not amazing but okay. worth every penny!","['edit', 'after', 'more', 'use', 'decent', 'performance', 'not', 'amazing', 'but', 'okay', 'worth', 'every', 'penny']","['edit', 'use', 'decent', 'performance', 'amazing', 'okay', 'worth', 'every', 'penny']","['edit', 'use', 'decent', 'performance', 'amazing', 'okay', 'worth', 'every', 'penny']"
"In my opinion, The display is absolutely stunning. Colors are vibrant and sharp. Super fast performance, handles multitasking effortlessly. Would buy again! Check my blog: www.reviews.com/mypost",4,True,9,positive,"in my opinion, the display is absolutely stunning. colors are vibrant and sharp. super fast performance, handles multitasking effortlessly. would buy again! check my blog:","['in', 'my', 'opinion', 'the', 'display', 'is', 'absolutely', 'stunning', 'colors', 'are', 'vibrant', 'and', 'sharp', 'super', 'fast', 'performance', 'handles', 'multitasking', 'effortlessly', 'would', 'buy', 'again', 'check', 'my', 'blog']","['opinion', 'display', 'absolutely', 'stunning', 'colors', 'vibrant', 'sharp', 'super', 'fast', 'performance', 'handles', 'multitasking', 'effortlessly', 'would', 'buy', 'check', 'blog']","['opinion', 'display', 'absolutely', 'stunning', 'color', 'vibrant', 'sharp', 'super', 'fast', 'performance', 'handle', 'multitasking', 'effortlessly', 'would', 'buy', 'check', 'blog']"
Just received it and Okay for occasional use. Disappointed overall.,3,True,3,neutral,just received it and okay for occasional use. disappointed overall.,"['just', 'received', 'it', 'and', 'okay', 'for', 'occasional', 'use', 'disappointed', 'overall']","['received', 'okay', 'occasional', 'use', 'disappointed', 'overall']","['received', 'okay', 'occasional', 'use', 'disappointed', 'overall']"
"EDIT: After more use, The screen resolution is perfect for watching movies. Total waste of money.",5,True,43,positive,"edit: after more use, the screen resolution is perfect for watching movies. total waste of money.","['edit', 'after', 'more', 'use', 'the', 'screen', 'resolution', 'is', 'perfect', 'for', 'watching', 'movies', 'total', 'waste', 'of', 'money']","['edit', 'use', 'screen', 'resolution', 'perfect', 'watching', 'movies', 'total', 'waste', 'money']","['edit', 'use', 'screen', 'resolution', 'perfect', 'watching', 'movie', 'total', 'waste', 'money']"
"Overall, Color is completely different from the photos. Runs very small, order 2 sizes up!",1,True,26,negative,"overall, color is completely different from the photos. runs very small, order 2 sizes up!","['overall', 'color', 'is', 'completely', 'different', 'from', 'the', 'photos', 'runs', 'very', 'small', 'order', 'sizes', 'up']","['overall', 'color', 'completely', 'different', 'photos', 'runs', 'small', 'order', 'sizes']","['overall', 'color', 'completely', 'different', 'photo', 'run', 'small', 'order', 'size']"
"In my opinion, Setup was incredibly easy, connected right away. Super fast performance, handles multitasking effortlessly. Worth every penny!",4,True,7,positive,"in my opinion, setup was incredibly easy, connected right away. super fast performance, handles multitasking effortlessly. worth every penny!","['in', 'my', 'opinion', 'setup', 'was', 'incredibly', 'easy', 'connected', 'right', 'away', 'super', 'fast', 'performance', 'handles', 'multitasking', 'effortlessly', 'worth', 'every', 'penny']","['opinion', 'setup', 'incredibly', 'easy', 'connected', 'right', 'away', 'super', 'fast', 'performance', 'handles', 'multitasking', 'effortlessly', 'worth', 'every', 'penny']","['opinion', 'setup', 'incredibly', 'easy', 'connected', 'right', 'away', 'super', 'fast', 'performance', 'handle', 'multitasking', 'effortlessly', 'worth', 'every', 'penny']"
"UPDATE: Quiet operation, barely makes any noise. Sturdy design, built to last. Total waste of money.",5,True,48,positive,"update: quiet operation, barely makes any noise. sturdy design, built to last. total waste of money.","['update', 'quiet', 'operation', 'barely', 'makes', 'any', 'noise', 'sturdy', 'design', 'built', 'to', 'last', 'total', 'waste', 'of', 'money']","['update', 'quiet', 'operation', 'barely', 'makes', 'noise', 'sturdy', 'design', 'built', 'last', 'total', 'waste', 'money']","['update', 'quiet', 'operation', 'barely', 'make', 'noise', 'sturdy', 'design', 'built', 'last', 'total', 'waste', 'money']"
"I must say, As expected from this brand. One star is too generous.",3,True,7,neutral,"i must say, as expected from this brand. one star is too generous.","['must', 'say', 'as', 'expected', 'from', 'this', 'brand', 'one', 'star', 'is', 'too', 'generous']","['must', 'say', 'expected', 'brand', 'one', 'star', 'generous']","['must', 'say', 'expected', 'brand', 'one', 'star', 'generous']"
"Overall, Color is completely different from the photos. One star is too generous.",2,False,27,negative,"overall, color is completely different from the photos. one star is too generous.","['overall', 'color', 'is', 'completely', 'different', 'from', 'the', 'photos', 'one', 'star', 'is', 'too', 'generous']","['overall', 'color', 'completely', 'different', 'photos', 'one', 'star', 'generous']","['overall', 'color', 'completely', 'different', 'photo', 'one', 'star', 'generous']"
"<p>Honestly, Sound quality is awful, tinny and distorted. Worth every penny!</p>",1,True,29,negative,"honestly, sound quality is awful, tinny and distorted. worth every penny!","['honestly', 'sound', 'quality', 'is', 'awful', 'tinny', 'and', 'distorted', 'worth', 'every', 'penny']","['honestly', 'sound', 'quality', 'awful', 'tinny', 'distorted', 'worth', 'every', 'penny']","['honestly', 'sound', 'quality', 'awful', 'tinny', 'distorted', 'worth', 'every', 'penny']"
"After using it for a month, Washes well, no fading or shrinking. Looks stylish and modern, gets compliments. Five stars from me!",5,False,31,positive,"after using it for a month, washes well, no fading or shrinking. looks stylish and modern, gets compliments. five stars from me!","['after', 'using', 'it', 'for', 'month', 'washes', 'well', 'no', 'fading', 'or', 'shrinking', 'looks', 'stylish', 'and', 'modern', 'gets', 'compliments', 'five', 'stars', 'from', 'me']","['using', 'month', 'washes', 'well', 'fading', 'shrinking', 'looks', 'stylish', 'modern', 'gets', 'compliments', 'five', 'stars']","['using', 'month', 'wash', 'well', 'fading', 'shrinking', 'look', 'stylish', 'modern', 'get', 'compliment', 'five', 'star']"
"<p>My experience: Standard quality, nothing remarkable.</p>",3,True,8,neutral,"my experience: standard quality, nothing remarkable.","['my', 'experience', 'standard', 'quality', 'nothing', 'remarkable']","['experience', 'standard', 'quality', 'nothing', 'remarkable']","['experience', 'standard', 'quality', 'nothing', 'remarkable']"
"UPDATE: Flimsy construction, feels like it will break. Difficult to clean, parts don't come apart easily. Five stars from me!",1,False,27,negative,"update: flimsy construction, feels like it will break. difficult to clean, parts don't come apart easily. five stars from me!","['update', 'flimsy', 'construction', 'feels', 'like', 'it', 'will', 'break', 'difficult', 'to', 'clean', 'parts', 'do', ""n't"", 'come', 'apart', 'easily', 'five', 'stars', 'from', 'me']","['update', 'flimsy', 'construction', 'feels', 'like', 'break', 'difficult', 'clean', 'parts', ""n't"", 'come', 'apart', 'easily', 'five', 'stars']","['update', 'flimsy', 'construction', 'feel', 'like', 'break', 'difficult', 'clean', 'part', ""n't"", 'come', 'apart', 'easily', 'five', 'star']"
"Just received it and Terrible fit, way too small even though I ordered my size. Faded badly after first wash. Perfect for my needs.",1,False,10,negative,"just received it and terrible fit, way too small even though i ordered my size. faded badly after first wash. perfect for my needs.","['just', 'received', 'it', 'and', 'terrible', 'fit', 'way', 'too', 'small', 'even', 'though', 'ordered', 'my', 'size', 'faded', 'badly', 'after', 'first', 'wash.', 'perfect', 'for', 'my', 'needs']","['received', 'terrible', 'fit', 'way', 'small', 'even', 'though', 'ordered', 'size', 'faded', 'badly', 'first', 'wash.', 'perfect', 'needs']","['received', 'terrible', 'fit', 'way', 'small', 'even', 'though', 'ordered', 'size', 'faded', 'badly', 'first', 'wash.', 'perfect', 'need']"
My experience: Easy to clean and maintain. Not recommended.,5,True,19,positive,my experience: easy to clean and maintain. not recommended.,"['my', 'experience', 'easy', 'to', 'clean', 'and', 'maintain', 'not', 'recommended']","['experience', 'easy', 'clean', 'maintain', 'recommended']","['experience', 'easy', 'clean', 'maintain', 'recommended']"
"To be honest, Okay for occasional use. Five stars from me!",3,True,0,neutral,"to be honest, okay for occasional use. five stars from me!","['to', 'be', 'honest', 'okay', 'for', 'occasional', 'use', 'five', 'stars', 'from', 'me']","['honest', 'okay', 'occasional', 'use', 'five', 'stars']","['honest', 'okay', 'occasional', 'use', 'five', 'star']"
"<p>Decent performance, not amazing but okay. Not recommended.</p>",3,True,6,neutral,"decent performance, not amazing but okay. not recommended.","['decent', 'performance', 'not', 'amazing', 'but', 'okay', 'not', 'recommended']","['decent', 'performance', 'amazing', 'okay', 'recommended']","['decent', 'performance', 'amazing', 'okay', 'recommended']"
"I must say, Way too loud, sounds like a jet engine. Total waste of money.",2,True,21,negative,"i must say, way too loud, sounds like a jet engine. total waste of money.","['must', 'say', 'way', 'too', 'loud', 'sounds', 'like', 'jet', 'engine', 'total', 'waste', 'of', 'money']","['must', 'say', 'way', 'loud', 'sounds', 'like', 'jet', 'engine', 'total', 'waste', 'money']","['must', 'say', 'way', 'loud', 'sound', 'like', 'jet', 'engine', 'total', 'waste', 'money']"
UPDATE: Looks cheap and poorly made. One star is too generous. Check my blog: www.reviews.com/mypost,1,True,13,negative,update: looks cheap and poorly made. one star is too generous. check my blog:,"['update', 'looks', 'cheap', 'and', 'poorly', 'made', 'one', 'star', 'is', 'too', 'generous', 'check', 'my', 'blog']","['update', 'looks', 'cheap', 'poorly', 'made', 'one', 'star', 'generous', 'check', 'blog']","['update', 'look', 'cheap', 'poorly', 'made', 'one', 'star', 'generous', 'check', 'blog']"
"After using it for a month, Standard quality, nothing remarkable.",3,True,10,neutral,"after using it for a month, standard quality, nothing remarkable.","['after', 'using', 'it', 'for', 'month', 'standard', 'quality', 'nothing', 'remarkable']","['using', 'month', 'standard', 'quality', 'nothing', 'remarkable']","['using', 'month', 'standard', 'quality', 'nothing', 'remarkable']"
"<p>UPDATE: Flimsy construction, feels like it will break. Missing basic features, very disappointed. Total waste of money.</p>",1,False,15,negative,"update: flimsy construction, feels like it will break. missing basic features, very disappointed. total waste of money.","['update', 'flimsy', 'construction', 'feels', 'like', 'it', 'will', 'break', 'missing', 'basic', 'features', 'very', 'disappointed', 'total', 'waste', 'of', 'money']","['update', 'flimsy', 'construction', 'feels', 'like', 'break', 'missing', 'basic', 'features', 'disappointed', 'total', 'waste', 'money']","['update', 'flimsy', 'construction', 'feel', 'like', 'break', 'missing', 'basic', 'feature', 'disappointed', 'total', 'waste', 'money']"
"In my opinion, Overpriced for such low quality. Overpriced for such low quality. Not recommended.",2,True,30,negative,"in my opinion, overpriced for such low quality. overpriced for such low quality. not recommended.","['in', 'my', 'opinion', 'overpriced', 'for', 'such', 'low', 'quality', 'overpriced', 'for', 'such', 'low', 'quality', 'not', 'recommended']","['opinion', 'overpriced', 'low', 'quality', 'overpriced', 'low', 'quality', 'recommended']","['opinion', 'overpriced', 'low', 'quality', 'overpriced', 'low', 'quality', 'recommended']"
"In my opinion, Difficult to clean, parts don't come apart easily. Takes up too much space, too bulky. Save your money.",2,True,27,negative,"in my opinion, difficult to clean, parts don't come apart easily. takes up too much space, too bulky. save your money.","['in', 'my', 'opinion', 'difficult', 'to', 'clean', 'parts', 'do', ""n't"", 'come', 'apart', 'easily', 'takes', 'up', 'too', 'much', 'space', 'too', 'bulky', 'save', 'your', 'money']","['opinion', 'difficult', 'clean', 'parts', ""n't"", 'come', 'apart', 'easily', 'takes', 'much', 'space', 'bulky', 'save', 'money']","['opinion', 'difficult', 'clean', 'part', ""n't"", 'come', 'apart', 'easily', 'take', 'much', 'space', 'bulky', 'save', 'money']"
UPDATE: The display is absolutely stunning. Colors are vibrant and sharp. Not recommended.,5,True,50,positive,update: the display is absolutely stunning. colors are vibrant and sharp. not recommended.,"['update', 'the', 'display', 'is', 'absolutely', 'stunning', 'colors', 'are', 'vibrant', 'and', 'sharp', 'not', 'recommended']","['update', 'display', 'absolutely', 'stunning', 'colors', 'vibrant', 'sharp', 'recommended']","['update', 'display', 'absolutely', 'stunning', 'color', 'vibrant', 'sharp', 'recommended']"
"<p>In my opinion, Compact size, fits perfectly in my space. Great features for the price. Save your money.</p> Contact me: reviewer@email.com",4,True,20,positive,"in my opinion, compact size, fits perfectly in my space. great features for the price. save your money. contact me: reviewer@email.com","['in', 'my', 'opinion', 'compact', 'size', 'fits', 'perfectly', 'in', 'my', 'space', 'great', 'features', 'for', 'the', 'price', 'save', 'your', 'money', 'contact', 'me', 'reviewer', 'email.com']","['opinion', 'compact', 'size', 'fits', 'perfectly', 'space', 'great', 'features', 'price', 'save', 'money', 'contact', 'reviewer', 'email.com']","['opinion', 'compact', 'size', 'fit', 'perfectly', 'space', 'great', 'feature', 'price', 'save', 'money', 'contact', 'reviewer', 'email.com']"
"In my opinion, As expected from this brand. You get what you pay for.",3,True,10,neutral,"in my opinion, as expected from this brand. you get what you pay for.","['in', 'my', 'opinion', 'as', 'expected', 'from', 'this', 'brand', 'you', 'get', 'what', 'you', 'pay', 'for']","['opinion', 'expected', 'brand', 'get', 'pay']","['opinion', 'expected', 'brand', 'get', 'pay']"
"EDIT: After more use, Decent performance, not amazing but okay. You get what you pay for.",3,True,1,neutral,"edit: after more use, decent performance, not amazing but okay. you get what you pay for.","['edit', 'after', 'more', 'use', 'decent', 'performance', 'not', 'amazing', 'but', 'okay', 'you', 'get', 'what', 'you', 'pay', 'for']","['edit', 'use', 'decent', 'performance', 'amazing', 'okay', 'get', 'pay']","['edit', 'use', 'decent', 'performance', 'amazing', 'okay', 'get', 'pay']"
"To be honest, Powerful and efficient, cleans thoroughly. Compact size, fits perfectly in my space. Total waste of money. Check my blog: www.reviews.com/mypost",5,True,24,positive,"to be honest, powerful and efficient, cleans thoroughly. compact size, fits perfectly in my space. total waste of money. check my blog:","['to', 'be', 'honest', 'powerful', 'and', 'efficient', 'cleans', 'thoroughly', 'compact', 'size', 'fits', 'perfectly', 'in', 'my', 'space', 'total', 'waste', 'of', 'money', 'check', 'my', 'blog']","['honest', 'powerful', 'efficient', 'cleans', 'thoroughly', 'compact', 'size', 'fits', 'perfectly', 'space', 'total', 'waste', 'money', 'check', 'blog']","['honest', 'powerful', 'efficient', 'clean', 'thoroughly', 'compact', 'size', 'fit', 'perfectly', 'space', 'total', 'waste', 'money', 'check', 'blog']"
"<p>To be honest, Overheats after just 10 minutes of use. Battery drains too quickly, barely lasts 3 hours. You get what you pay for.</p>",1,True,7,negative,"to be honest, overheats after just 10 minutes of use. battery drains too quickly, barely lasts 3 hours. you get what you pay for.","['to', 'be', 'honest', 'overheats', 'after', 'just', '10', 'minutes', 'of', 'use', 'battery', 'drains', 'too', 'quickly', 'barely', 'lasts', 'hours', 'you', 'get', 'what', 'you', 'pay', 'for']","['honest', 'overheats', '10', 'minutes', 'use', 'battery', 'drains', 'quickly', 'barely', 'lasts', 'hours', 'get', 'pay']","['honest', 'overheats', '10', 'minute', 'use', 'battery', 'drain', 'quickly', 'barely', 'last', 'hour', 'get', 'pay']"
"<p>In my opinion, Works like a charm! Makes perfect coffee every morning. Powerful and efficient, cleans thoroughly. You get what you pay for.</p> Contact me: reviewer@email.com",5,True,15,positive,"in my opinion, works like a charm! makes perfect coffee every morning. powerful and efficient, cleans thoroughly. you get what you pay for. contact me: reviewer@email.com","['in', 'my', 'opinion', 'works', 'like', 'charm', 'makes', 'perfect', 'coffee', 'every', 'morning', 'powerful', 'and', 'efficient', 'cleans', 'thoroughly', 'you', 'get', 'what', 'you', 'pay', 'for', 'contact', 'me', 'reviewer', 'email.com']","['opinion', 'works', 'like', 'charm', 'makes', 'perfect', 'coffee', 'every', 'morning', 'powerful', 'efficient', 'cleans', 'thoroughly', 'get', 'pay', 'contact', 'reviewer', 'email.com']","['opinion', 'work', 'like', 'charm', 'make', 'perfect', 'coffee', 'every', 'morning', 'powerful', 'efficient', 'clean', 'thoroughly', 'get', 'pay', 'contact', 'reviewer', 'email.com']"
"Overall, Standard quality, nothing remarkable. Disappointed overall.",3,False,0,neutral,"overall, standard quality, nothing remarkable. disappointed overall.","['overall', 'standard', 'quality', 'nothing', 'remarkable', 'disappointed', 'overall']","['overall', 'standard', 'quality', 'nothing', 'remarkable', 'disappointed', 'overall']","['overall', 'standard', 'quality', 'nothing', 'remarkable', 'disappointed', 'overall']"
"<p>After using it for a month, Powerful and efficient, cleans thoroughly. Compact size, fits perfectly in my space. Disappointed overall.</p>",5,True,42,positive,"after using it for a month, powerful and efficient, cleans thoroughly. compact size, fits perfectly in my space. disappointed overall.","['after', 'using', 'it', 'for', 'month', 'powerful', 'and', 'efficient', 'cleans', 'thoroughly', 'compact', 'size', 'fits', 'perfectly', 'in', 'my', 'space', 'disappointed', 'overall']","['using', 'month', 'powerful', 'efficient', 'cleans', 'thoroughly', 'compact', 'size', 'fits', 'perfectly', 'space', 'disappointed', 'overall']","['using', 'month', 'powerful', 'efficient', 'clean', 'thoroughly', 'compact', 'size', 'fit', 'perfectly', 'space', 'disappointed', 'overall']"
"<p>Takes up too much space, too bulky. Five stars from me!</p> Check my blog: www.reviews.com/mypost",1,True,27,negative,"takes up too much space, too bulky. five stars from me! check my blog:","['takes', 'up', 'too', 'much', 'space', 'too', 'bulky', 'five', 'stars', 'from', 'me', 'check', 'my', 'blog']","['takes', 'much', 'space', 'bulky', 'five', 'stars', 'check', 'blog']","['take', 'much', 'space', 'bulky', 'five', 'star', 'check', 'blog']"
"To be honest, Great build quality, feels premium and solid. The screen resolution is perfect for watching movies. Not recommended.",4,True,11,positive,"to be honest, great build quality, feels premium and solid. the screen resolution is perfect for watching movies. not recommended.","['to', 'be', 'honest', 'great', 'build', 'quality', 'feels', 'premium', 'and', 'solid', 'the', 'screen', 'resolution', 'is', 'perfect', 'for', 'watching', 'movies', 'not', 'recommended']","['honest', 'great', 'build', 'quality', 'feels', 'premium', 'solid', 'screen', 'resolution', 'perfect', 'watching', 'movies', 'recommended']","['honest', 'great', 'build', 'quality', 'feel', 'premium', 'solid', 'screen', 'resolution', 'perfect', 'watching', 'movie', 'recommended']"
